abstract,author,doi,url,publication month,publication year,title,publisher,crossref_field,semantic_field,label,authors_parsed,orkg_abstract_doi,orkg_abstract_title
"Vacuum ultraviolet emission from Ar-H2 wave driven microwave (2.45 GHz) plasmas operating at low pressures (0.1–1 mbar) has been investigated. The emitted spectra show the presence of the Ar resonance lines at 104.8 and 106.7 nm and of the Lyman-α,β atomic lines at 121.6 nm and 102.6 nm, respectively. The increase of the hydrogen amount in the mixture results in an abrupt increase of the Werner and Lyman molecular bands intensity. The Lyman-β intensity shows little changes in the range of 5%–30% of hydrogen in the mixture while the Lyman-α intensity tends to decrease as the percentage of hydrogen increases.","[' C. M. Ferreira', ' F. M. Dias', 'Elena Tatarova', 'Edgar Felizardo', 'Susana Espinho']",10.1063/1.4796134,,3.0,2013.0,vacuum ultraviolet emission from microwave ar-h2 plasmas,Applied Physics Letters,"{'abstract': '', 'crossref_field': (['Physics and Astronomy (miscellaneous)'],), 'publisher': ['Applied Physics Letters'], 'doi': '10.1063/1.4796134', 'url': 'http://dx.doi.org/10.1063/1.4796134'}","{'abstract': 'Vacuum ultraviolet emission from Ar-H2 wave driven microwave (2.45\u2009GHz) plasmas operating at low pressures (0.1–1\u2009mbar) has been investigated. The emitted spectra show the presence of the Ar resonance lines at 104.8 and 106.7\u2009nm and of the Lyman-α,β atomic lines at 121.6\u2009nm and 102.6\u2009nm, respectively. The increase of the hydrogen amount in the mixture results in an abrupt increase of the Werner and Lyman molecular bands intensity. The Lyman-β intensity shows little changes in the range of 5%–30% of hydrogen in the mixture while the Lyman-α intensity tends to decrease as the percentage of hydrogen increases.', 'semantic_field': ['Chemistry'], 'publisher': '', 'doi': '10.1063/1.4796134', 'url': 'https://www.semanticscholar.org/paper/f87cd447d6d94825b78b16a59573ec29ee2d0dc1'}","Atomic, Molecular and Optical Physics","[['Ferreira', 'C. M.', '', ''], ['Dias', 'F. M.', '', ''], ['Tatarova', 'Elena ', '', ''], ['Felizardo', 'Edgar ', '', ''], ['Espinho', 'Susana ', '', '']]","vacuum ultraviolet emission from ar-h2 wave driven microwave (2.45\u2009ghz) plasmas operating at low pressures (0.1–1\u2009mbar) has been investigated. the emitted spectra show the presence of the ar resonance lines at 104.8 and 106.7\u2009nm and of the lyman-α,β atomic lines at 121.6\u2009nm and 102.6\u2009nm, respectively. the increase of the hydrogen amount in the mixture results in an abrupt increase of the werner and lyman molecular bands intensity. the lyman-β intensity shows little changes in the range of 5%–30% of hydrogen in the mixture while the lyman-α intensity tends to decrease as the percentage of hydrogen increases.","vacuum ultraviolet emission from ar-h2 wave driven microwave (2.45\u2009ghz) plasmas operating at low pressures (0.1–1\u2009mbar) has been investigated. the emitted spectra show the presence of the ar resonance lines at 104.8 and 106.7\u2009nm and of the lyman-α,β atomic lines at 121.6\u2009nm and 102.6\u2009nm, respectively. the increase of the hydrogen amount in the mixture results in an abrupt increase of the werner and lyman molecular bands intensity. the lyman-β intensity shows little changes in the range of 5%–30% of hydrogen in the mixture while the lyman-α intensity tends to decrease as the percentage of hydrogen increases."
"Vacuum ultraviolet (VUV) photons emitted from excited atomic states are ubiquitous in material processing plasmas. The highly energetic photons can induce surface damage by driving surface reactions, disordering surface regions, and affecting bonds in the bulk material. In argon plasmas, the VUV emissions are due to the decay of the 1s4 and 1s2 principal resonance levels with emission wavelengths of 104.8 and 106.7 nm, respectively. The authors have measured the number densities of atoms in the two resonance levels using both white light optical absorption spectroscopy and radiation-trapping induced changes in the 3p54p→3p54s branching fractions measured via visible/near-infrared optical emission spectroscopy in an argon inductively coupled plasma as a function of both pressure and power. An emission model that takes into account radiation trapping was used to calculate the VUV emission rate. The model results were compared to experimental measurements made with a National Institute of Standards and Techn...","[' Persing H', ' Radovanov S ', ' Wendt A', ' Wang S', 'C Culver', ' Lin C', 'Boffard J']",10.1116/1.4859376,,,2014.0,comparison of surface vacuum ultraviolet emissions with resonance level number densities. i. argon plasmas,,"{'abstract': '', 'crossref_field': (['Surfaces, Coatings and Films', 'Surfaces and Interfaces', 'Condensed Matter Physics'],), 'publisher': ['Journal of Vacuum Science &amp; Technology A: Vacuum, Surfaces, and Films'], 'doi': '10.1116/1.4859376', 'url': 'http://dx.doi.org/10.1116/1.4859376'}","{'abstract': 'Vacuum ultraviolet (VUV) photons emitted from excited atomic states are ubiquitous in material processing plasmas. The highly energetic photons can induce surface damage by driving surface reactions, disordering surface regions, and affecting bonds in the bulk material. In argon plasmas, the VUV emissions are due to the decay of the 1s4 and 1s2 principal resonance levels with emission wavelengths of 104.8 and 106.7\u2009nm, respectively. The authors have measured the number densities of atoms in the two resonance levels using both white light optical absorption spectroscopy and radiation-trapping induced changes in the 3p54p→3p54s branching fractions measured via visible/near-infrared optical emission spectroscopy in an argon inductively coupled plasma as a function of both pressure and power. An emission model that takes into account radiation trapping was used to calculate the VUV emission rate. The model results were compared to experimental measurements made with a National Institute of Standards and Techn...', 'semantic_field': ['Chemistry'], 'publisher': '', 'doi': '10.1116/1.4859376', 'url': 'https://www.semanticscholar.org/paper/37a88327e9e2969ebdf08e0bedeae2b24f447707'}","Atomic, Molecular and Optical Physics","[['H', 'Persing ', '', ''], ['S', 'Radovanov ', '', ''], ['A', 'Wendt ', '', ''], ['S', 'Wang ', '', ''], ['Culver', 'C ', '', ''], ['C', 'Lin ', '', ''], ['J', 'Boffard ', '', '']]","vacuum ultraviolet (vuv) photons emitted from excited atomic states are ubiquitous in material processing plasmas. the highly energetic photons can induce surface damage by driving surface reactions, disordering surface regions, and affecting bonds in the bulk material. in argon plasmas, the vuv emissions are due to the decay of the 1s4 and 1s2 principal resonance levels with emission wavelengths of 104.8 and 106.7\u2009nm, respectively. the authors have measured the number densities of atoms in the two resonance levels using both white light optical absorption spectroscopy and radiation-trapping induced changes in the 3p54p→3p54s branching fractions measured via visible/near-infrared optical emission spectroscopy in an argon inductively coupled plasma as a function of both pressure and power. an emission model that takes into account radiation trapping was used to calculate the vuv emission rate. the model results were compared to experimental measurements made with a national institute of standards and techn...","vacuum ultraviolet (vuv) photons emitted from excited atomic states are ubiquitous in material processing plasmas. the highly energetic photons can induce surface damage by driving surface reactions, disordering surface regions, and affecting bonds in the bulk material. in argon plasmas, the vuv emissions are due to the decay of the 1s4 and 1s2 principal resonance levels with emission wavelengths of 104.8 and 106.7\u2009nm, respectively. the authors have measured the number densities of atoms in the two resonance levels using both white light optical absorption spectroscopy and radiation-trapping induced changes in the 3p54p→3p54s branching fractions measured via visible/near-infrared optical emission spectroscopy in an argon inductively coupled plasma as a function of both pressure and power. an emission model that takes into account radiation trapping was used to calculate the vuv emission rate. the model results were compared to experimental measurements made with a national institute of standards and techn..."
{},"['Green', ""O'Loughlin""]",,,,,invader-invader mutualism influences land snail community composition and alters invasion success of alien species in tropical rainforest,,{},{},Ecology and Evolutionary Biology,"[['', 'Green ', '', ''], ['', ""O'Loughlin "", '', '']]",no_abstract_found,no_abstract_found
{},Grove et al,,,,,persistence of a soil legacy following removal of a nitrogen-fixing invader,,{},{},Ecology and Evolutionary Biology,"['Grove', '', '', '']",no_abstract_found,no_abstract_found
{},Liu et al,,,,,"the positive interaction between two nonindigenous species, casuarina (casuarina equisetifolia) and acacia (acacia mangium), in the tropical coastal zone of south china: stand dynamics and soil nutrients",,{},{},Ecology and Evolutionary Biology,"['Liu', '', '', '']",no_abstract_found,"the role of mixed forests in tropical coastal south china is unclear due to a long history of afforestation with a casuarina (casuarina equisetifolia) monoculture. in this study, we determined how the stand dynamics and soil nutrients in monoculture stands of casuarina equisetifolia were influenced by acacia (acacia mangium), a fast-growing pioneer species, when the two tree species were combined in two initial proportions. we also compared the canopy conditions of mixed and monoculture stands of c. equisetifolia at the young stage. over a period of ten years, the density of stems was relatively low in c. equisetifolia ×acacia mangium mixed stands compared to c. equisetifolia monoculture stands. by contrast, the aboveground biomass, understory diversity and soil nutrients were relatively high in c. equisetifolia ×a. mangium mixed stands, particularly when the initial mixing proportion of a. mangium was greater. moreover, c. equisetifolia can protect a. mangium in the windy coastal environment by ensuring evenly distributed crown growth, intact canopy conditions, and high leaf area index (lai) during the young stage. in conclusion, the two species had a positive interaction in the mixed forests, which suggests that coastal conservation managers need to shift from their traditional focus on c. equisetifolia single-species afforestation to multi-tree species mixed afforestation."
